{
  "race": "Belgian Grand Prix",
  "round": 12,
  "season": 2026,
  "circuit": "Spa-Francorchamps",
  "date": "2026-07-19",
  "is_sprint_weekend": false,
  "generated_at": "2026-07-06T13:09:46.245359+00:00",
  "drivers": [
    {
      "driver_id": "VER",
      "name": "Max Verstappen",
      "constructor": "red_bull",
      "number": 33,
      "predicted_quali": 3,
      "predicted_finish": 1,
      "projected_points": 39.1,
      "expected_points": 29.3,
      "expected_points_quali": 7.0,
      "expected_points_race": 22.2,
      "confidence": 65,
      "risk": "MEDIUM",
      "risk_rating": 14.2,
      "dnf_probability": 0.14,
      "expected_overtakes": 8,
      "expected_positions_gained_lost": 2,
      "fastest_lap_probability": 0.15,
      "dotd_probability": 0.11,
      "points_per_million": 0.74,
      "value_score": 1.05,
      "current_price": 27.9,
      "raw_scores": {
        "quali": 2.133963,
        "race": 3.335566
      },
      "mc_total_mean": 29.3,
      "mc_total_std": 19.4,
      "mc_total_p5": -11.1,
      "mc_total_p25": 23.0,
      "mc_total_p75": 43.0,
      "mc_total_p95": 53.0,
      "mc_upside": 20.7,
      "mc_dnf_rate": 0.2,
      "mc_overtakes_mean": 6.6,
      "mc_quali_pts_mean": 7.0,
      "mc_race_pts_mean": 22.2
    },
    {
      "driver_id": "RUS",
      "name": "George Russell",
      "constructor": "mercedes",
      "number": 63,
      "predicted_quali": 2,
      "predicted_finish": 2,
      "projected_points": 30.6,
      "expected_points": 25.4,
      "expected_points_quali": 7.1,
      "expected_points_race": 18.3,
      "confidence": 65,
      "risk": "MEDIUM",
      "risk_rating": 14.2,
      "dnf_probability": 0.14,
      "expected_overtakes": 6,
      "expected_positions_gained_lost": 0,
      "fastest_lap_probability": 0.15,
      "dotd_probability": 0.11,
      "points_per_million": 1.28,
      "value_score": 0.91,
      "current_price": 27.8,
      "raw_scores": {
        "quali": 2.14341,
        "race": 2.93867
      },
      "mc_total_mean": 25.4,
      "mc_total_std": 18.3,
      "mc_total_p5": -11.1,
      "mc_total_p25": 18.0,
      "mc_total_p75": 39.0,
      "mc_total_p95": 50.0,
      "mc_upside": 18.6,
      "mc_dnf_rate": 0.2,
      "mc_overtakes_mean": 5.2,
      "mc_quali_pts_mean": 7.1,
      "mc_race_pts_mean": 18.3
    },
    {
      "driver_id": "ANT",
      "name": "Kimi Antonelli",
      "constructor": "mercedes",
      "number": 12,
      "predicted_quali": 1,
      "predicted_finish": 3,
      "projected_points": 29.1,
      "expected_points": 25.3,
      "expected_points_quali": 8.5,
      "expected_points_race": 16.8,
      "confidence": 66,
      "risk": "LOW",
      "risk_rating": 8.3,
      "dnf_probability": 0.08,
      "expected_overtakes": 6,
      "expected_positions_gained_lost": -2,
      "fastest_lap_probability": 0.15,
      "dotd_probability": 0.11,
      "points_per_million": 0.71,
      "value_score": 1.0,
      "current_price": 25.4,
      "raw_scores": {
        "quali": 2.658936,
        "race": 2.740725
      },
      "mc_total_mean": 25.3,
      "mc_total_std": 14.8,
      "mc_total_p5": -7.3,
      "mc_total_p25": 19.0,
      "mc_total_p75": 37.0,
      "mc_total_p95": 47.0,
      "mc_upside": 15.7,
      "mc_dnf_rate": 0.1,
      "mc_overtakes_mean": 3.7,
      "mc_quali_pts_mean": 8.5,
      "mc_race_pts_mean": 16.8
    },
    {
      "driver_id": "HAM",
      "name": "Lewis Hamilton",
      "constructor": "ferrari",
      "number": 44,
      "predicted_quali": 4,
      "predicted_finish": 4,
      "projected_points": 22.9,
      "expected_points": 19.4,
      "expected_points_quali": 6.9,
      "expected_points_race": 12.6,
      "confidence": 66,
      "risk": "LOW",
      "risk_rating": 6.0,
      "dnf_probability": 0.06,
      "expected_overtakes": 4,
      "expected_positions_gained_lost": 0,
      "fastest_lap_probability": 0.07,
      "dotd_probability": 0.07,
      "points_per_million": 1.58,
      "value_score": 0.79,
      "current_price": 24.5,
      "raw_scores": {
        "quali": 2.079974,
        "race": 1.653989
      },
      "mc_total_mean": 19.4,
      "mc_total_std": 13.6,
      "mc_total_p5": -7.8,
      "mc_total_p25": 12.0,
      "mc_total_p75": 28.0,
      "mc_total_p95": 41.0,
      "mc_upside": 17.6,
      "mc_dnf_rate": 0.1,
      "mc_overtakes_mean": 4.9,
      "mc_quali_pts_mean": 6.9,
      "mc_race_pts_mean": 12.6
    },
    {
      "driver_id": "LEC",
      "name": "Charles Leclerc",
      "constructor": "ferrari",
      "number": 16,
      "predicted_quali": 5,
      "predicted_finish": 5,
      "projected_points": 17.5,
      "expected_points": 16.2,
      "expected_points_quali": 6.6,
      "expected_points_race": 9.5,
      "confidence": 67,
      "risk": "MEDIUM",
      "risk_rating": 16.6,
      "dnf_probability": 0.17,
      "expected_overtakes": 4,
      "expected_positions_gained_lost": 0,
      "fastest_lap_probability": 0.07,
      "dotd_probability": 0.07,
      "points_per_million": 0.91,
      "value_score": 0.7,
      "current_price": 23.2,
      "raw_scores": {
        "quali": 1.98082,
        "race": 1.625958
      },
      "mc_total_mean": 16.2,
      "mc_total_std": 16.0,
      "mc_total_p5": -11.8,
      "mc_total_p25": 6.0,
      "mc_total_p75": 27.0,
      "mc_total_p95": 42.0,
      "mc_upside": 18.8,
      "mc_dnf_rate": 0.2,
      "mc_overtakes_mean": 5.0,
      "mc_quali_pts_mean": 6.6,
      "mc_race_pts_mean": 9.5
    },
    {
      "driver_id": "HAD",
      "name": "Isack Hadjar",
      "constructor": "red_bull",
      "number": 6,
      "predicted_quali": 7,
      "predicted_finish": 6,
      "projected_points": 14.7,
      "expected_points": 12.4,
      "expected_points_quali": 4.0,
      "expected_points_race": 8.5,
      "confidence": 67,
      "risk": "MEDIUM",
      "risk_rating": 20.1,
      "dnf_probability": 0.2,
      "expected_overtakes": 5,
      "expected_positions_gained_lost": 1,
      "fastest_lap_probability": 0.07,
      "dotd_probability": 0.07,
      "points_per_million": 1.57,
      "value_score": 0.98,
      "current_price": 12.7,
      "raw_scores": {
        "quali": 1.232986,
        "race": 1.180935
      },
      "mc_total_mean": 12.4,
      "mc_total_std": 16.8,
      "mc_total_p5": -15.4,
      "mc_total_p25": 2.0,
      "mc_total_p75": 24.0,
      "mc_total_p95": 39.0,
      "mc_upside": 20.6,
      "mc_dnf_rate": 0.2,
      "mc_overtakes_mean": 5.1,
      "mc_quali_pts_mean": 4.0,
      "mc_race_pts_mean": 8.5
    },
    {
      "driver_id": "PIA",
      "name": "Oscar Piastri",
      "constructor": "mclaren",
      "number": 81,
      "predicted_quali": 8,
      "predicted_finish": 7,
      "projected_points": 14.4,
      "expected_points": 15.0,
      "expected_points_quali": 3.8,
      "expected_points_race": 11.3,
      "confidence": 67,
      "risk": "LOW",
      "risk_rating": 6.0,
      "dnf_probability": 0.06,
      "expected_overtakes": 5,
      "expected_positions_gained_lost": 1,
      "fastest_lap_probability": 0.04,
      "dotd_probability": 0.03,
      "points_per_million": 0.82,
      "value_score": 0.6,
      "current_price": 24.9,
      "raw_scores": {
        "quali": 1.173254,
        "race": 1.024167
      },
      "mc_total_mean": 15.0,
      "mc_total_std": 13.7,
      "mc_total_p5": -11.4,
      "mc_total_p25": 6.0,
      "mc_total_p75": 24.0,
      "mc_total_p95": 38.0,
      "mc_upside": 17.0,
      "mc_dnf_rate": 0.1,
      "mc_overtakes_mean": 4.7,
      "mc_quali_pts_mean": 3.8,
      "mc_race_pts_mean": 11.3
    },
    {
      "driver_id": "NOR",
      "name": "Lando Norris",
      "constructor": "mclaren",
      "number": 4,
      "predicted_quali": 6,
      "predicted_finish": 8,
      "projected_points": 8.3,
      "expected_points": 9.7,
      "expected_points_quali": 4.4,
      "expected_points_race": 5.3,
      "confidence": 68,
      "risk": "MEDIUM",
      "risk_rating": 22.5,
      "dnf_probability": 0.23,
      "expected_overtakes": 4,
      "expected_positions_gained_lost": -2,
      "fastest_lap_probability": 0.04,
      "dotd_probability": 0.03,
      "points_per_million": 0.94,
      "value_score": 0.38,
      "current_price": 25.6,
      "raw_scores": {
        "quali": 1.355752,
        "race": 1.017402
      },
      "mc_total_mean": 9.7,
      "mc_total_std": 15.8,
      "mc_total_p5": -15.0,
      "mc_total_p25": -2.0,
      "mc_total_p75": 20.0,
      "mc_total_p95": 35.0,
      "mc_upside": 19.3,
      "mc_dnf_rate": 0.2,
      "mc_overtakes_mean": 4.1,
      "mc_quali_pts_mean": 4.4,
      "mc_race_pts_mean": 5.3
    },
    {
      "driver_id": "LIN",
      "name": "Arvid Lindblad",
      "constructor": "racing_bulls",
      "number": 40,
      "predicted_quali": 11,
      "predicted_finish": 10,
      "projected_points": 6.7,
      "expected_points": 8.7,
      "expected_points_quali": 1.0,
      "expected_points_race": 7.7,
      "confidence": 69,
      "risk": "LOW",
      "risk_rating": 6.0,
      "dnf_probability": 0.06,
      "expected_overtakes": 5,
      "expected_positions_gained_lost": 1,
      "fastest_lap_probability": 0.04,
      "dotd_probability": 0.03,
      "points_per_million": 1.83,
      "value_score": 1.4,
      "current_price": 6.2,
      "raw_scores": {
        "quali": 0.200126,
        "race": -0.433093
      },
      "mc_total_mean": 8.7,
      "mc_total_std": 11.9,
      "mc_total_p5": -13.4,
      "mc_total_p25": 2.0,
      "mc_total_p75": 15.0,
      "mc_total_p95": 30.0,
      "mc_upside": 15.3,
      "mc_dnf_rate": 0.1,
      "mc_overtakes_mean": 5.3,
      "mc_quali_pts_mean": 1.0,
      "mc_race_pts_mean": 7.7
    },
    {
      "driver_id": "LAW",
      "name": "Liam Lawson",
      "constructor": "racing_bulls",
      "number": 30,
      "predicted_quali": 9,
      "predicted_finish": 9,
      "projected_points": 6.5,
      "expected_points": 4.0,
      "expected_points_quali": 1.8,
      "expected_points_race": 2.1,